{
  "schema_version": 1,
  "generated_at": "2026-10-31T06:34:34Z",
  "origin": "https://zackees.github.io/soldr-toolchain/catalogue.v1.json",
  "entries": [
    {
      "owner": "zackees",
      "repo": "soldr-toolchain",
      "tag": "assets",
      "asset": "rust-nightly-versions.v1.json",
      "url": "https://zackees.github.io/soldr-toolchain/sha256/4a94228b573cb8955cef1bfbb8751cca6b0f1c753058fa3394aea3a91ac722f7/rust-nightly-versions.v1.json",
      "sha256": "4a94228b573cb8955cef1bfbb8751cca6b0f1c753058fa3394aea3a91ac722f7"
    },
    {
      "owner": "zackees",
      "repo": "soldr-toolchain-private",
      "tag": "msvc-14.44.35207",
      "asset": "bundle.tar.zst",
      "url": "https://api.github.com/repos/zackees/soldr-toolchain-private/releases/assets/505002676",
      "sha256": "932d9e36cbad6243b6ca9e50332b258f7efeb086d2f21c80447738064418c714"
    }
  ]
}
